{
  "$schema": "http://json-schema.org/draft-07/schema#",
  "$id": "https://raw.githubusercontent.com/amajorai/ryu-marketplace/HEAD/schema/ryu.package.schema.json",
  "title": "Ryu portable package envelope",
  "type": "object",
  "required": [
    "schemaVersion",
    "id",
    "name",
    "version",
    "kind",
    "artifacts",
    "targets",
    "scopes",
    "requires",
    "capabilities",
    "security"
  ],
  "properties": {
    "$schema": { "type": "string", "format": "uri" },
    "schemaVersion": { "const": 1 },
    "id": { "type": "string", "minLength": 1 },
    "name": { "type": "string", "minLength": 1 },
    "version": {
      "type": "string",
      "pattern": "^v?\\d+\\.\\d+\\.\\d+(?:[-+][0-9A-Za-z.-]+)?$"
    },
    "kind": {
      "enum": [
        "plugin",
        "app",
        "skill",
        "agent",
        "workflow",
        "theme",
        "language_pack",
        "output_style",
        "space",
        "profile",
        "bundle"
      ]
    },
    "artifacts": {
      "type": "array",
      "items": { "type": "string", "minLength": 1 }
    },
    "targets": {
      "type": "array",
      "items": { "type": "string", "minLength": 1 }
    },
    "scopes": {
      "type": "array",
      "items": {
        "enum": ["desktop", "node", "gateway", "agent", "space", "workflow"]
      }
    },
    "requires": {
      "type": "object",
      "additionalProperties": { "type": "string" }
    },
    "capabilities": { "type": "array", "items": { "type": "string" } },
    "includes": { "type": "array", "items": { "type": "string" } },
    "source": { "$ref": "#/definitions/source" },
    "security": { "$ref": "#/definitions/security" },
    "allowRemix": {
      "type": "boolean",
      "default": true,
      "description": "Whether others may remix this package: copy it into an editable item of their own and publish it with a remixedFrom credit. Absent means allowed; set false to opt out."
    },
    "remixedFrom": { "$ref": "#/definitions/remixedFrom" },
    "metadata": { "type": "object", "additionalProperties": true }
  },
  "additionalProperties": true,
  "definitions": {
    "remixedFrom": {
      "type": "object",
      "description": "The marketplace listing this package was remixed from.",
      "required": ["kind", "id"],
      "properties": {
        "kind": { "type": "string", "minLength": 1 },
        "id": { "type": "string", "minLength": 1 },
        "version": { "type": "string" }
      },
      "additionalProperties": false
    },
    "source": {
      "type": "object",
      "required": ["type"],
      "properties": {
        "type": { "enum": ["github", "local", "archive"] },
        "repository": { "type": "string" },
        "path": { "type": "string" },
        "ref": { "type": "string" },
        "commit": { "type": "string" },
        "checksum": { "type": "string", "pattern": "^[a-f0-9]{64}$" }
      },
      "additionalProperties": false
    },
    "security": {
      "type": "object",
      "required": [
        "containsSecrets",
        "permissions",
        "privateContent",
        "redacted"
      ],
      "properties": {
        "containsSecrets": { "type": "boolean" },
        "permissions": { "type": "array", "items": { "type": "string" } },
        "privateContent": { "type": "boolean" },
        "redacted": { "type": "boolean" }
      },
      "additionalProperties": false
    }
  }
}
