{
  "$schema": "https://raw.githubusercontent.com/amajorai/ryu-marketplace/HEAD/schema/ryu.package.schema.json",
  "schemaVersion": 1,
  "id": "ryu/bundle/video",
  "name": "Video",
  "version": "0.5.0",
  "kind": "bundle",
  "artifacts": [
    "bundle.json"
  ],
  "targets": [
    "desktop"
  ],
  "scopes": [
    "desktop"
  ],
  "requires": {},
  "capabilities": [
    "bundle:ui-skills:video"
  ],
  "includes": [
    "skill:antfu/skills/slidev",
    "skill:arifszn/slide-wright/slide-wright",
    "skill:figma/mcp-server-guide/figma-implement-motion",
    "skill:remotion-dev/skills/remotion-best-practices",
    "skill:iart-ai/web-animation-skills/lottie-animation"
  ],
  "source": {
    "type": "github",
    "repository": "amajorai/ryu-marketplace",
    "path": "bundles/video",
    "ref": "main"
  },
  "security": {
    "containsSecrets": false,
    "permissions": [],
    "privateContent": false,
    "redacted": false
  },
  "metadata": {
    "tagline": "From storyboard to a polished, programmable frame.",
    "category": "UI Skills",
    "description": "The Video topic collection from UI Skills for Slidev, presentations, motion handoff, Lottie, and Remotion production practices.",
    "author": "Ryu",
    "sourceUrl": "https://www.ui-skills.com/skills/video"
  }
}
