{
  "$schema": "https://raw.githubusercontent.com/amajorai/ryu-marketplace/HEAD/schema/ryu.package.schema.json",
  "schemaVersion": 1,
  "id": "ryu/bundle/remotion",
  "name": "Remotion",
  "version": "0.5.0",
  "kind": "bundle",
  "artifacts": [
    "bundle.json"
  ],
  "targets": [
    "desktop"
  ],
  "scopes": [
    "desktop"
  ],
  "requires": {},
  "capabilities": [
    "bundle:ui-skills:remotion"
  ],
  "includes": [
    "skill:remotion-dev/skills/remotion-best-practices",
    "skill:emilkowalski/skills/animate",
    "skill:iart-ai/web-animation-skills/lottie-animation"
  ],
  "source": {
    "type": "github",
    "repository": "amajorai/ryu-marketplace",
    "path": "bundles/remotion",
    "ref": "main"
  },
  "security": {
    "containsSecrets": false,
    "permissions": [],
    "privateContent": false,
    "redacted": false
  },
  "metadata": {
    "tagline": "Compose deterministic video with React.",
    "category": "UI Skills",
    "description": "The Remotion topic bundle from UI Skills, with production practices, animation, and Lottie interoperability.",
    "author": "Ryu",
    "sourceUrl": "https://www.ui-skills.com/skills/remotion"
  }
}
