{
  "$schema": "https://raw.githubusercontent.com/amajorai/ryu-marketplace/HEAD/schema/ryu.package.schema.json",
  "schemaVersion": 1,
  "id": "ryu/bundle/color",
  "name": "Color",
  "version": "0.5.0",
  "kind": "bundle",
  "artifacts": [
    "bundle.json"
  ],
  "targets": [
    "desktop"
  ],
  "scopes": [
    "desktop"
  ],
  "requires": {},
  "capabilities": [
    "bundle:ui-skills:color"
  ],
  "includes": [
    "skill:accesslint/skills/contrast-checker",
    "skill:accesslint/skills/use-of-color",
    "skill:firebenders/sync-figma-token-skill/sync-figma-token",
    "skill:jakubkrehel/skills/better-colors",
    "skill:jakubkrehel/skills/better-accessibility"
  ],
  "source": {
    "type": "github",
    "repository": "amajorai/ryu-marketplace",
    "path": "bundles/color",
    "ref": "main"
  },
  "security": {
    "containsSecrets": false,
    "permissions": [],
    "privateContent": false,
    "redacted": false
  },
  "metadata": {
    "tagline": "Color systems that are expressive, legible, and intentional.",
    "category": "UI Skills",
    "description": "The Color topic collection from UI Skills for contrast, tokenized palettes, OKLCH workflows, and inclusive use of color.",
    "author": "Ryu",
    "sourceUrl": "https://www.ui-skills.com/skills/color"
  }
}
