{
  "$schema": "https://raw.githubusercontent.com/amajorai/ryu-marketplace/HEAD/schema/ryu.package.schema.json",
  "schemaVersion": 1,
  "id": "ryu/bundle/interaction",
  "name": "Interaction",
  "version": "0.5.0",
  "kind": "bundle",
  "artifacts": [
    "bundle.json"
  ],
  "targets": [
    "desktop"
  ],
  "scopes": [
    "desktop"
  ],
  "requires": {},
  "capabilities": [
    "bundle:ui-skills:interaction"
  ],
  "includes": [
    "skill:0xdesign/design-plugin/design-lab",
    "skill:accesslint/skills/link-purpose",
    "skill:anthropics/skills/canvas-design",
    "skill:cloudai-x/threejs-skills/threejs-fundamentals",
    "skill:cloudai-x/threejs-skills/threejs-interaction",
    "skill:emilkowalski/skills/apple-design",
    "skill:iart-ai/web-animation-skills/micro-interaction",
    "skill:jakubkrehel/skills/better-interface"
  ],
  "source": {
    "type": "github",
    "repository": "amajorai/ryu-marketplace",
    "path": "bundles/interaction",
    "ref": "main"
  },
  "security": {
    "containsSecrets": false,
    "permissions": [],
    "privateContent": false,
    "redacted": false
  },
  "metadata": {
    "tagline": "Interfaces that respond with clarity and confidence.",
    "category": "UI Skills",
    "description": "The Interaction topic collection from UI Skills for controls, gesture feel, input behavior, transitions, and responsive feedback.",
    "author": "Ryu",
    "sourceUrl": "https://www.ui-skills.com/skills/interaction"
  }
}
