{
  "$schema": "https://raw.githubusercontent.com/amajorai/ryu-marketplace/HEAD/schema/ryu.package.schema.json",
  "schemaVersion": 1,
  "id": "ryu/bundle/frontend",
  "name": "Frontend",
  "version": "0.5.0",
  "kind": "bundle",
  "artifacts": [
    "bundle.json"
  ],
  "targets": [
    "desktop"
  ],
  "scopes": [
    "desktop"
  ],
  "requires": {},
  "capabilities": [
    "bundle:ui-skills:frontend"
  ],
  "includes": [
    "skill:accesslint/skills/accessibility-diff",
    "skill:accesslint/skills/accessibility-scan",
    "skill:accesslint/skills/audit-and-fix",
    "skill:addyosmani/agent-skills/frontend-ui-engineering",
    "skill:anthropics/skills/frontend-design",
    "skill:ibelick/ui-skills/fixing-accessibility",
    "skill:jakubkrehel/skills/better-interface",
    "skill:vercel-labs/agent-skills/vercel-react-best-practices"
  ],
  "source": {
    "type": "github",
    "repository": "amajorai/ryu-marketplace",
    "path": "bundles/frontend",
    "ref": "main"
  },
  "security": {
    "containsSecrets": false,
    "permissions": [],
    "privateContent": false,
    "redacted": false
  },
  "metadata": {
    "tagline": "A practical frontend foundation for building the real thing.",
    "category": "UI Skills",
    "description": "The Frontend topic collection from UI Skills for component architecture, responsive implementation, accessibility, and production-quality React work.",
    "author": "Ryu",
    "sourceUrl": "https://www.ui-skills.com/skills/frontend"
  }
}
