{
  "$schema": "https://raw.githubusercontent.com/amajorai/ryu-marketplace/HEAD/schema/ryu.package.schema.json",
  "schemaVersion": 1,
  "id": "ryu/bundle/threejs",
  "name": "Three.js",
  "version": "0.5.0",
  "kind": "bundle",
  "artifacts": [
    "bundle.json"
  ],
  "targets": [
    "desktop"
  ],
  "scopes": [
    "desktop"
  ],
  "requires": {},
  "capabilities": [
    "bundle:ui-skills:threejs"
  ],
  "includes": [
    "skill:cloudai-x/threejs-skills/threejs-animation",
    "skill:cloudai-x/threejs-skills/threejs-fundamentals",
    "skill:cloudai-x/threejs-skills/threejs-geometry",
    "skill:cloudai-x/threejs-skills/threejs-interaction",
    "skill:cloudai-x/threejs-skills/threejs-lighting",
    "skill:cloudai-x/threejs-skills/threejs-loaders",
    "skill:cloudai-x/threejs-skills/threejs-materials",
    "skill:cloudai-x/threejs-skills/threejs-postprocessing",
    "skill:cloudai-x/threejs-skills/threejs-shaders",
    "skill:cloudai-x/threejs-skills/threejs-textures",
    "skill:flornkm/skills/webgl-components"
  ],
  "source": {
    "type": "github",
    "repository": "amajorai/ryu-marketplace",
    "path": "bundles/threejs",
    "ref": "main"
  },
  "security": {
    "containsSecrets": false,
    "permissions": [],
    "privateContent": false,
    "redacted": false
  },
  "metadata": {
    "tagline": "A grounded Three.js workflow from scene to shader.",
    "category": "UI Skills",
    "description": "The Three.js topic collection from UI Skills for scenes, geometry, materials, lighting, loaders, shaders, post-processing, and interaction.",
    "author": "Ryu",
    "sourceUrl": "https://www.ui-skills.com/skills/three.js"
  }
}
