{
  "$schema": "https://raw.githubusercontent.com/amajorai/ryu-marketplace/HEAD/schema/ryu.package.schema.json",
  "schemaVersion": 1,
  "id": "ryu/bundle/performance",
  "name": "Performance",
  "version": "0.5.0",
  "kind": "bundle",
  "artifacts": [
    "bundle.json"
  ],
  "targets": [
    "desktop"
  ],
  "scopes": [
    "desktop"
  ],
  "requires": {},
  "capabilities": [
    "bundle:ui-skills:performance"
  ],
  "includes": [
    "skill:addyosmani/web-quality-skills/core-web-vitals",
    "skill:addyosmani/web-quality-skills/performance",
    "skill:callstackincubator/agent-skills/react-native-best-practices",
    "skill:cloudai-x/threejs-skills/threejs-lighting",
    "skill:cloudai-x/threejs-skills/threejs-loaders",
    "skill:ibelick/ui-skills/fixing-motion-performance",
    "skill:vercel-labs/agent-skills/vercel-react-best-practices"
  ],
  "source": {
    "type": "github",
    "repository": "amajorai/ryu-marketplace",
    "path": "bundles/performance",
    "ref": "main"
  },
  "security": {
    "containsSecrets": false,
    "permissions": [],
    "privateContent": false,
    "redacted": false
  },
  "metadata": {
    "tagline": "Make fast experiences a built-in design constraint.",
    "category": "UI Skills",
    "description": "The Performance topic collection from UI Skills for Web Vitals, React Native, motion performance, and efficient 3D loading.",
    "author": "Ryu",
    "sourceUrl": "https://www.ui-skills.com/skills/performance"
  }
}
