{
  "$schema": "https://raw.githubusercontent.com/amajorai/ryu-marketplace/HEAD/schema/ryu.package.schema.json",
  "schemaVersion": 1,
  "id": "ryu/workflow/adversarial-verification",
  "name": "Adversarial Verification",
  "version": "0.5.0",
  "kind": "workflow",
  "artifacts": [
    "workflow.json"
  ],
  "targets": [
    "ryu-desktop",
    "ryu-cli"
  ],
  "scopes": [
    "workflow"
  ],
  "requires": {},
  "capabilities": [
    "workflow:adversarial-verification"
  ],
  "source": {
    "type": "github",
    "repository": "amajorai/ryu-marketplace",
    "path": "workflows/adversarial-verification",
    "ref": "main"
  },
  "security": {
    "containsSecrets": false,
    "permissions": [],
    "privateContent": false,
    "redacted": false
  },
  "metadata": {
    "description": "Generate an answer, have N independent verifiers vote, and accept on majority — else revise.",
    "category": "quality",
    "pattern": "adversarial-verification",
    "icon": "ShieldCheck",
    "nodeCount": 7,
    "tags": [
      "verification",
      "voting",
      "quality",
      "sub-agents"
    ]
  }
}
