{
  "$schema": "https://raw.githubusercontent.com/amajorai/ryu-marketplace/HEAD/schema/ryu.package.schema.json",
  "schemaVersion": 1,
  "id": "ryu/workflow/parallelization",
  "name": "Parallelization",
  "version": "0.5.0",
  "kind": "workflow",
  "artifacts": [
    "workflow.json"
  ],
  "targets": [
    "ryu-desktop",
    "ryu-cli"
  ],
  "scopes": [
    "workflow"
  ],
  "requires": {},
  "capabilities": [
    "workflow:parallelization"
  ],
  "source": {
    "type": "github",
    "repository": "amajorai/ryu-marketplace",
    "path": "workflows/parallelization",
    "ref": "main"
  },
  "security": {
    "containsSecrets": false,
    "permissions": [],
    "privateContent": false,
    "redacted": false
  },
  "metadata": {
    "description": "Fan the task out to independent clean-context workers, then synthesize their results.",
    "category": "orchestration",
    "pattern": "parallelization",
    "icon": "Network",
    "nodeCount": 4,
    "tags": [
      "parallel",
      "fan-out",
      "sub-agents"
    ]
  }
}
