{
  "$schema": "https://raw.githubusercontent.com/amajorai/ryu-marketplace/HEAD/schema/ryu.package.schema.json",
  "schemaVersion": 1,
  "id": "ryu/bundle/tooling",
  "name": "Tooling",
  "version": "0.5.0",
  "kind": "bundle",
  "artifacts": [
    "bundle.json"
  ],
  "targets": [
    "desktop"
  ],
  "scopes": [
    "desktop"
  ],
  "requires": {},
  "capabilities": [
    "bundle:ui-skills:tooling"
  ],
  "includes": [
    "skill:aashaexo/soundshuman/humanize",
    "skill:aboudjem/humanizer-skill/humanizer",
    "skill:aminblg/simpleenglish/simple-english",
    "skill:antfu/skills/antfu",
    "skill:antfu/skills/pnpm",
    "skill:antfu/skills/tsdown",
    "skill:antfu/skills/turborepo",
    "skill:antfu/skills/unocss",
    "skill:antfu/skills/vite",
    "skill:antfu/skills/vitepress",
    "skill:antfu/skills/vitest",
    "skill:antfu/skills/vueuse-functions",
    "skill:cursor/plugins/unslop",
    "skill:elithrar/dotfiles/anti-slop"
  ],
  "source": {
    "type": "github",
    "repository": "amajorai/ryu-marketplace",
    "path": "bundles/tooling",
    "ref": "main"
  },
  "security": {
    "containsSecrets": false,
    "permissions": [],
    "privateContent": false,
    "redacted": false
  },
  "metadata": {
    "tagline": "A calm, opinionated toolchain for shipping UI.",
    "category": "UI Skills",
    "description": "The Tooling topic collection from UI Skills for package managers, build tools, monorepos, Vite, Vue, tests, and clean output.",
    "author": "Ryu",
    "sourceUrl": "https://www.ui-skills.com/skills/tooling"
  }
}
