{
  "$schema": "https://raw.githubusercontent.com/amajorai/ryu-marketplace/HEAD/schema/ryu.package.schema.json",
  "schemaVersion": 1,
  "id": "ryu/workflow/classify-and-act",
  "name": "Classify & Act",
  "version": "0.5.0",
  "kind": "workflow",
  "artifacts": [
    "workflow.json"
  ],
  "targets": [
    "ryu-desktop",
    "ryu-cli"
  ],
  "scopes": [
    "workflow"
  ],
  "requires": {},
  "capabilities": [
    "workflow:classify-and-act"
  ],
  "source": {
    "type": "github",
    "repository": "amajorai/ryu-marketplace",
    "path": "workflows/classify-and-act",
    "ref": "main"
  },
  "security": {
    "containsSecrets": false,
    "permissions": [],
    "privateContent": false,
    "redacted": false
  },
  "metadata": {
    "description": "Classify the request, then hand it to a specialized agent per class.",
    "category": "orchestration",
    "pattern": "classify-and-act",
    "icon": "ListTree",
    "nodeCount": 6,
    "tags": [
      "classify",
      "routing",
      "agents"
    ]
  }
}
