{
  "$schema": "https://raw.githubusercontent.com/amajorai/ryu-marketplace/HEAD/schema/ryu.package.schema.json",
  "schemaVersion": 1,
  "id": "ryu/bundle/motion",
  "name": "Motion",
  "version": "0.5.0",
  "kind": "bundle",
  "artifacts": [
    "bundle.json"
  ],
  "targets": [
    "desktop"
  ],
  "scopes": [
    "desktop"
  ],
  "requires": {},
  "capabilities": [
    "bundle:ui-skills:motion"
  ],
  "includes": [
    "skill:cloudai-x/threejs-skills/threejs-animation",
    "skill:emilkowalski/skills/animate",
    "skill:emilkowalski/skills/animate-expo",
    "skill:emilkowalski/skills/animation-vocabulary",
    "skill:emilkowalski/skills/find-animation-opportunities",
    "skill:emilkowalski/skills/improve-animations",
    "skill:emilkowalski/skills/review-animations",
    "skill:iart-ai/web-animation-skills/accessible-animation",
    "skill:iart-ai/web-animation-skills/micro-interaction",
    "skill:iart-ai/web-animation-skills/page-transition-animation",
    "skill:iart-ai/web-animation-skills/svg-animation"
  ],
  "source": {
    "type": "github",
    "repository": "amajorai/ryu-marketplace",
    "path": "bundles/motion",
    "ref": "main"
  },
  "security": {
    "containsSecrets": false,
    "permissions": [],
    "privateContent": false,
    "redacted": false
  },
  "metadata": {
    "tagline": "Motion with purpose, feel, and a reduced-motion path.",
    "category": "UI Skills",
    "description": "The Motion topic collection from UI Skills for meaningful transitions, micro-interactions, animation systems, and accessible movement.",
    "author": "Ryu",
    "sourceUrl": "https://www.ui-skills.com/skills/motion"
  }
}
