{
  "$schema": "https://raw.githubusercontent.com/amajorai/ryu-marketplace/HEAD/schema/ryu.package.schema.json",
  "schemaVersion": 1,
  "id": "ryu/bundle/nuxt",
  "name": "Nuxt",
  "version": "0.5.0",
  "kind": "bundle",
  "artifacts": [
    "bundle.json"
  ],
  "targets": [
    "desktop"
  ],
  "scopes": [
    "desktop"
  ],
  "requires": {},
  "capabilities": [
    "bundle:ui-skills:nuxt"
  ],
  "includes": [
    "skill:antfu/skills/nuxt",
    "skill:antfu/skills/nitro",
    "skill:antfu/skills/vue",
    "skill:antfu/skills/pinia",
    "skill:antfu/skills/vue-router-best-practices",
    "skill:antfu/skills/vueuse-functions"
  ],
  "source": {
    "type": "github",
    "repository": "amajorai/ryu-marketplace",
    "path": "bundles/nuxt",
    "ref": "main"
  },
  "security": {
    "containsSecrets": false,
    "permissions": [],
    "privateContent": false,
    "redacted": false
  },
  "metadata": {
    "tagline": "Full-stack Vue with a sharp Nuxt workflow.",
    "category": "UI Skills",
    "description": "The Nuxt topic collection from UI Skills for SSR, Nitro routes, Vue state, routing, and composition patterns.",
    "author": "Ryu",
    "sourceUrl": "https://www.ui-skills.com/skills/nuxt"
  }
}
